category_id,category_name,description,picture
1,Beverages,"Soft drinks, coffees, teas, beers, and ales",<memory at 0x000002F59094DE80>
2,Condiments,"Sweet and savory sauces, relishes, spreads, and seasonings",<memory at 0x000002F59094DDC0>
3,Confections,"Desserts, candies, and sweet breads",<memory at 0x000002F590A1CA00>
4,Dairy Products,Cheeses,<memory at 0x000002F590A1C880>
5,Grains/Cereals,"Breads, crackers, pasta, and cereal",<memory at 0x000002F590A1C700>
6,Meat/Poultry,Prepared meats,<memory at 0x000002F590A1C580>
7,Produce,Dried fruit and bean curd,<memory at 0x000002F590A1C400>
8,Seafood,Seaweed and fish,<memory at 0x000002F590A1C280>
